numero,score_site,texto_relato,label_ia,data_coleta,qtd_gatilhos
011989524529,7,"Acredito ser golpe, pois ouvi vozes no fundo de 3 homens, e não era som de um ambiente de trabalho, eles comentado algo e gargalhando.",1,23/03/2026,1
011989524529,7,"Assim como aos demais, me ligaram desse número e por mais de um minuto passaram a ligação entre dois homens diferentes que pediam para que eu aguardasse na linha e, por fim, transferiram para uma moça, que me ofereceu um modem da Claro. Ela pediu para que eu confirmasse meu CEP para que pudessem enviar o mesmo. Certamente neguei, até porque já possuo internet em casa, porém quando eu o fiz, ela questionou se eu tinha o modem da claro. Já trabalhei em call center e acho no mínimo estranho eles não saberem se tenho ou não o tal modem.Fiquem espertos com isso, tem ""cheiro"" de golpe. Irei bloquear o número, conforme recomendado em outros comentários.",1,23/03/2026,2
011989524529,7,"Acredito que seja algum tipo de golpe. Tem uma semana que recebo essas ligações...sempre com a voz feminina perguntando: ""alô, esta me ouvindo?""....para em seguida passar para uma voz masculina pedindo para aguardar.Creio se tratar de hacker...com a função de rastrear localização.Para isso necessita de algum tempo com a ligação em aberto.ATENÇÃO!!!! Atendeu....desliga imediatamente.",1,23/03/2026,1
011989524529,7,"agora, liga com o número 989524529 e não fala nada.",1,23/03/2026,0
011989524529,7,Me liga o dia inteiro e depois chama de novo dizendo que tem recado na caixa postal *555Todo dia a mesma coisa 11-989524529,1,23/03/2026,0
01129283850,6,Hotline de televendas Uma voz de mulher diz Alô em seguida fica mudo e cai a ligação,1,23/03/2026,0
01129283850,6,"Tentativa de golpe Um cara começou a falar e eu desliguei mas não era um robô era uma voz desconhecida e estava com ""efeito de voz""",1,23/03/2026,1
01129283850,6,"como Chamada de robô Quando atendo, robô diz Alo e cai a ligação.",1,23/03/2026,0
01129283850,6,como Chamada de robô Liga e não responde quem é desliga na cara,1,23/03/2026,0
01129283850,6,Tentativa de golpe Tentativa de golpe,1,23/03/2026,1
01129283850,6,Chamada de robô () como Propaganda agressiva,1,23/03/2026,0
01129283850,6,Tentativa de golpe,1,23/03/2026,1
08001509009,7,Agência de cobrança Mensagens de cobrança diárias ameaçando protesto com acesso parcial a informações pessoais (primeiro nome e parte da numeração de documento),1,23/03/2026,1
08001509009,7,Agência de cobrança Mensagens com cobranças diárias. Solicitando retorno em ligação,1,23/03/2026,0
08001509009,7,Agência de cobrança Receber ligações relacionadas a dívidas de um número gratuito parece estranho.,1,23/03/2026,0
02430749370,8,Tentativa de golpe spam bloqueado,1,23/03/2026,2
02430749370,8,"robô call diz ""alô"" e só prossegue após ouvir voz humana, na certa é venda pré gravada ou iria transferir pra algum atendente. A tim me liga direto do DDD21 pra oferece upgrade, como eu sempre bloqueio agora eles ligam do DDD24, pode ter sido a TIM ou nao. Mas a ligação é indesejada do mesmo jeito.",1,23/03/2026,2
02430749370,8,como Chamador Silencioso Ligação silenciosa,1,23/03/2026,0
02430749370,8,Tentativa de golpe Tentativa de golpe,1,23/03/2026,1
02430749370,8,"Tentativa de golpe Ligamento falando que é da claro , e querem falar com alguém sem nome , só responsável .",1,23/03/2026,2
02430749370,8,foi avaliado como Tentativa de golpe (),1,23/03/2026,1
02430749370,8,Hotline de televendas,1,23/03/2026,0
011920835950,8,Tentativa de golpe Tentativa de golpe bancario,1,23/03/2026,1
011920835950,8,Tentativa de golpe,1,23/03/2026,1
011920835950,8,() como Ameaça por telefone,1,23/03/2026,1
010406000000,7,"esse número aparece quando digito *#62#Carlos Meu tbmYas O meu tbm mdsAlec Meu tbmdeivid to com esse numero me monitorando, alguem sabe resolver?PESSOA ESTÁ NO MEU TAMBÉM, COMO DESVIO DE CHAMADA.Rodrigo Pelo que eu vi, somente quem tem chip da claro quando digita *#62# aparece esse número, se for de outra operadora não aparece nada, mas se for da claro apareceJosué Bezerra Ribeiro Este número aparece quando faço o comando *#62# e me aparece este número citado",1,23/03/2026,1
010406000000,7,iPhoneavaliou o númerocom Score 5 Perigo,1,23/03/2026,0
010406000000,7,Estou com esse numero dizendo que está sincronizado com mensagens de voz no meu celularNumero que está sincronizado 010406000000,1,23/03/2026,0
010406000000,7,"como Desvio de chamadas Queria saber como desativar isso, já tentei várias e várias vezes, mas não consigo, fica lá, o que eu faço.",1,23/03/2026,0
010406000000,7,e nunca tinha o visto.,1,23/03/2026,0
010406000000,7,Desvio de chamadas () como Tentativa de golpe Estou tentando bloquear mas esse numero continua aparecendo no meu celular (e de minha mãe). Como faço para tirar de vez esse numero do celular?,1,23/03/2026,1
010406000000,7,aparece quando eu coloquei o código,1,23/03/2026,0
010406000000,7,como Desvio de chamadas Meu celular tá em sincronização com esse número +5510406000000,1,23/03/2026,0
010406000000,7,o númerocomo Desvio de chamadas Esse número grampio Meu celular não sei como,1,23/03/2026,0
010406000000,7,Desvio de chamadas foi avaliado como Tentativa de golpe () Ouvindo minha ligações,1,23/03/2026,1
010406000000,7,Tentativa de golpe Esse número está me espionando,1,23/03/2026,1
010406000000,7,foi avaliado como Tentativa de golpe () Golpe,1,23/03/2026,1
010406000000,7,Desvio de chamadas () como Tentativa de golpe Está no meu aparelho do celular no Décio de chamada de voz e na sincronização do meu celulardeivid conseguiu resolver?,1,23/03/2026,1
010406000000,7,Tentativa de golpe Da dando desvio de chamadas não consigo abri meu WhatsApp ele ta me espionando,1,23/03/2026,1
010406000000,7,como Desvio de chamadas Descobri já um tempo que esse número 010406000000 está me espionando todas minhas ligações feitas no meu celular,1,23/03/2026,0
010406000000,7,como Desvio de chamadas minhas ligações são desviadas para esse numero,1,23/03/2026,0
010406000000,7,Esse número aparece no meu cllr quando digito *#62#,1,23/03/2026,0
010406000000,7,Pra resolver entrei nas configuracoes de desvio de chamadas e alterei o numero pra um numero secundario meu ai deu certo.,1,23/03/2026,0
010406000000,7,como +5510406000000 Esse número está me rastreando,1,23/03/2026,0
010406000000,7,como +5510406000000 Vi que este numero se repete varias vezes quando digito *#62#,1,23/03/2026,0
010406000000,7,foi avaliado como Tentativa de golpe () Esse numero aparece quando eu coloco *#62# não sei se é clonagem me disseram q é numero q vai da caixa postal,1,23/03/2026,1
010406000000,7,Tentativa de golpe Esse número aparece pra mim me rastreando,1,23/03/2026,1
010406000000,7,"+5510406000000 () como Pesquisa de opinião Bom dia, é verdade que esse número +5510406000000 está rastreando meu celular? Quando digita a chamada *#62# que aparece ele..Alguém me diz alguma coisa por favor..",1,23/03/2026,0
010406000000,7,como +5510406000000 Está desviando minhas ligações,1,23/03/2026,0
010406000000,7,como não sei apareceu que esse número tava me rastreando,1,23/03/2026,0
010406000000,7,+5510406000000 () como Ameaça por telefone Esse número está rastreando minhas ligações,1,23/03/2026,1
010406000000,7,aparece quando digito *#62#,1,23/03/2026,0
010406000000,7,como +5510406000000 Tentativa de golpe,1,23/03/2026,1
010406000000,7,+5510406000000 () como Tentativa de golpe Estão desviando ligação do meu número,1,23/03/2026,1
010406000000,7,como +5510406000000 Esse número aparece espionando minhas chamadasCláudia Não conheço Esse Número. É De Golpes.,1,23/03/2026,1
010406000000,7,+5510406000000 () como Tentativa de golpe Este numero esta me espionando,1,23/03/2026,1
010406000000,7,Número sério Esse número está desviando minhas ligações,1,23/03/2026,0
010406000000,7,foi avaliado como Tentativa de golpe () esse número está espionando minhas ligações,1,23/03/2026,1
010406000000,7,estão encaminhando minhas ligações pra esse numero,1,23/03/2026,0
010406000000,7,Esse número está rastreando minhas ligações,1,23/03/2026,0
010406000000,7,Tentativa de golpe Desvia minhas chamadas número,1,23/03/2026,1
010406000000,7,raquiou meu número,1,23/03/2026,0
010406000000,7,Descobri que esse número esta espionando minhas ligacoções isso e crime.,1,23/03/2026,0
010406000000,7,foi avaliado como Tentativa de golpe () Descobri hoje que minhas chamadas telefônicas estão sendo Espionadas por este número +5510406000000naiana nossa as minhas tambem oque fazer ???,1,23/03/2026,1
031985516984,8,foi avaliado como Tentativa de golpe () numero de golpista liga falando que foi feito um compra no seu banco e pede pra aperta em números pra fazer confirmação cuidado com este tipo de golpe,1,23/03/2026,2
01634341643,8,Ameaça por telefone Spam de robocalls automatizados.,1,23/03/2026,3
071991367742,6,Tentativa de golpe,1,23/03/2026,1
08000005567,8,Tentativa de golpe GOLPE USO CARTAO,1,23/03/2026,2
08000005567,8,"Hotline de televendas Ligação gratuita, sem ideia do que a pessoa quer.",1,23/03/2026,0
08000005567,8,"spam SMS Spam SMS se fazendo passar por central de cartões do banco Itaú, sugerindo clicar no número 08000005567 para solucionar uma situação de num alto valor em Reai compra num cartão virtual.Beto Confirmo essa informação. Caso receba algum SMS, com informação falsa de compra no cartão Itaú, bloqueie esse número. É GOLPE!",1,23/03/2026,4
03033333,9,Tentativa de golpe,1,23/03/2026,1
080032831323,9,Tentativa de golpe Golpe do falso advogado,1,23/03/2026,3
080032831323,9,Tentativa de golpe Desabilitamos sua conta Instagram,1,23/03/2026,1
011915801918,8,foi avaliado como Tentativa de golpe () Jumal.,1,23/03/2026,1
011969331673,8,Tentativa de golpe Pedindo para confirmar uma compra que nunca foi feita !!!!!!,1,23/03/2026,1
055981171669,8,"Ameaça por telefone Operações fraudulentas de call center, aparentemente fazem ligações internacionais.",1,23/03/2026,2
01135213121,8,Tentativa de golpe acredito que seja golpe!,1,23/03/2026,1
01135213121,8,"ligou três vezes consecutivas mesmo eu recusando a ligação e o identificador de chamadas acusando ser spam, aí eu bloqueei o número por precaução.",1,23/03/2026,1
01135213121,8,foi avaliado como Chamada perdida () ninguém fala e desliga a ligação,1,23/03/2026,0
01135213121,8,Tentativa de golpe fala alô e fica mudo em seguida e desliga,1,23/03/2026,1
01135213121,8,() como spam SMS,1,23/03/2026,1
01135213121,8,Propaganda agressiva,1,23/03/2026,0
035736586,9,Tentativa de golpe +3 ligações que vou mandar Anatel kkk,1,23/03/2026,1
035736586,9,Tentativa de golpe Bandos de tranqueiras que só ligam e não é quem procura preguiçosos adora telefone fifi,1,23/03/2026,1
011946358106,8,foi avaliado como Tentativa de golpe () Jumal.,1,23/03/2026,1
04121690200,7,"Prezados, sou administradora do escritório Hilú, Costódio & Caron Batista - Sociedade de Advogados, informo que este número (41) 2169-0200 é atribuído a nosso escritório indevidamente por alguns sites, mas não é nosso. Portanto, a(s) ligação(ões) recebidas de tal número de telefone não tiveram origem de nosso escritório e não temos ciência de sua efetiva origem. Atenciosamente, Alecsandra Carla Ferreira.Rodrigo Exatamente isso que acontece comigo - aparece o nome desse ""Hilu"" na identificação. Achei estranho aparecer o nome porque não tenho esse número salvo na lista de contatos. Obrigado.Raro Desculpe, mas então vocês precisam tomar uma providência. Se foram clonados precisam resolver isso com a operadora.",1,23/03/2026,2
04121690200,7,"Propaganda agressiva Ligam e dizem ""Alô? Está me ouvindo? Só um minuto."" Após, ou cai a ligação, ou um chato fala sobre oportunidades imperdíveis...",1,23/03/2026,0
04121690200,7,Tentativa de golpe golpista fdp,1,23/03/2026,1
04121690200,7,"Não costumo atender ligações desconhecidas, e simplesmente recuso a chamada. Esse número em certo momento tentou me ligar, eu recusei, não deu 3 segundos tentaram ligar DENOVO, eu RECUSEI DENOVO, e ai em menos de 3 segundos tentaram ligar DENOVO...Cláudia Acontece comigo também. Todos os dias, recuso e ligam novamente e novamente. Está insuportável.",1,23/03/2026,0
04121690200,7,Tentativa de golpe Fica mudo depois entra informações da claro e solicita para digitar,1,23/03/2026,2
04121690200,7,DEPOIS DE VÁRIAS TENTATIVAS DE NÚEMROS DE CLEULAR AGORA ME LIARAM DESTE NÚMERO ACREDITO QUE SEJA A CLARO SENDO QUE É LEI QUE TODO TELEMARKENTIG TEM QUE VIR 0303 NA FRENTE DE TODOS NÚMEROS DE TELEFONE QUE USAREM,1,23/03/2026,1
04121690200,7,Liga e desliga sem falar nada,1,23/03/2026,1
04121690200,7,Tentativa de golpe Mesma coisa dos comentários acima.,1,23/03/2026,1
04121690200,7,() como Ameaça por telefone Liga e muitas vezes não diz nada. Qdo falam perguntam oi tem alguém aí? Muito suspeito!!!!,1,23/03/2026,1
04121690200,7,CLEAR () como Propaganda agressiva Propaganda da operadora claro.,1,23/03/2026,1
04121690200,7,"Me ligaram falando que seria da operadora claro, e estavam oferecendo serviços de credito para internt, mas a mulher não era profissional, estava notório que ela estava lendo! Saquei na hora que serie golpe, outro detalhe, meu número é de outra operadora.... Nisso eu desliguei! não caiam nesse golpe, nem fale muito, eles podem gravar sua voz e usar ela depois... Se liguem, fiquem bem atentos. GOLPEEEEEEEE< BANDOS DE GOLPISTAS>",1,23/03/2026,2
04121690200,7,"Tentativa de golpe Liga o dia todo, já bloqueei.",1,23/03/2026,1
04121690200,7,"Diz que é da claro oferecendo portabilidade. Informa vários benefícios , no final pede rg e cpf pra confirmar, desliguei. Deve ser golpe.",1,23/03/2026,2
04121690200,7,"Recebi a ligação agora pouco, atendi porque eu sou uma pessoa muito curiosa. Quando atendi a linha ficou em silêncio por exatamente 8 segundos. Fiquei com muito medo. O numero era do Paraná.",1,23/03/2026,0
04121690200,7,"Propaganda agressiva O numero me liga diversas vezes, tanto de dia quanto a noite e eu não aguento mais",1,23/03/2026,0
04121690200,7,Propaganda agressiva Número da claro ligam para encher o saco.,1,23/03/2026,1
04121690200,7,"São organizações criminosas que usam esses telefones! Cadê o Presidente da República, o qual disse que iria moralizar o Brasil? Gente, nós já estamos cansados de tanta empulhação. ATÉ QUANDO?",1,23/03/2026,0
04121690200,7,"Liga, diz alô e depois desliga.",1,23/03/2026,0
04121690200,7,Número de cobranças da Claro.,1,23/03/2026,1
04121690200,7,Hotline de televendas OFERECE TELEMARKETING,1,23/03/2026,0
04121690200,7,"Chamada via robo, não sei do que se trata pois a ligação cai quando atendo.",1,23/03/2026,1
04121690200,7,"Direto me ligam desse e ate de outros número na verdade, e é basicamente a mesma coisa. Fala ""Alô, alguém ai?"" Com uma voz de mulher meio q de gravação, as vezes perguntam se eu sou eu ""vc é Talita ... ...?"" Sempre bloqueio mas me ligam de novo de outros números. Nunca fiquem falando muito quando for assim, pode ser algum golpe em que gravam sua voz e usam depois pra alguma transição.",1,23/03/2026,2
04121690200,7,"numero liga mas nao fiz nada, deve ser calote",1,23/03/2026,0
04121690200,7,FICAM LIGANDO E NUNCA FALAM NADA E DESLIGAM.,1,23/03/2026,0
04121690200,7,"CLEAR foi avaliado como Propaganda agressiva () O atendente se identificou como sendo da claro e qdo eu disse que não tinha interesse em nenhum serviço, disse que ia continuar me ligando e que ia me perturbar. Foram 15 ligações seguidas em 12min. Falou meu endereço é disse que sabe onde eu moro.desconhecida me ligaram também falando a mesma proposta.. Mas não aceitei, e desliguei.",1,23/03/2026,1
04121690200,7,"Liga, pergunta: ""Alguém aí?"" e desliga.",1,23/03/2026,0
04121690200,7,esse numero liga aqui para o escritório umas 5 vezes ao dia. já estou enlouquecendo!,1,23/03/2026,0
04121690200,7,Ligam o dia todo. Qdo a gente atende não fala nada e cai.,1,23/03/2026,0
04121690200,7,Propaganda agressiva sistema eletrônico de encheção de saco,1,23/03/2026,0
04121690200,7,"Liga, uma gravação pede para esperar, música de espera e depois cai a ligação. Provavelmente telemarketing.joana golpe, acabaram de me ligar se passando pela clao",1,23/03/2026,1
04121690200,7,"Liga direto e e desligam, perturba de manhã até de noite",1,23/03/2026,0
04121690200,7,foi avaliado como Tentativa de golpe (),1,23/03/2026,1
04121690200,7,Hotline de televendas,1,23/03/2026,0
04121690200,7,Tentativa de golpe,1,23/03/2026,1
04121690200,7,@ sax. qe1A ZaZaxx@- deNize,1,23/03/2026,0
04121690200,7,Agência de cobrança,1,23/03/2026,0
02130828382,8,"Propaganda agressiva Parem de me incomodar, spammers.",1,23/03/2026,1
01132302016,5,Número sério gravação pra dizer nossos código por ligação .,0,23/03/2026,0
01132302016,5,Número sério esse número é original usado da Uber pra parceiros,0,23/03/2026,0
01132302016,5,"Ameaça por telefone ligou e falou uma frase em ingles ,, bnao intendo muito bem , mas eh augo relacionado a comunicaçao e contou de 5 a 1 em ingles",1,23/03/2026,1
01132302016,5,Ameaça por telefone,1,23/03/2026,1
01132302016,5,como Uber (gravação),0,23/03/2026,0
04135219050,8,"Tentativa de golpe É golpe, chamada insistentemente",1,23/03/2026,1
04135219050,8,"Hotline de televendas Era uma chamada de telemarketing, e a chamada foi interrompida, ficando em silêncio no meio da conversa.",1,23/03/2026,0
04135219050,8,Spam de telemarketing foi avaliado como Hotline de televendas (),1,23/03/2026,1
011998714585,8,foi avaliado como Tentativa de golpe () Jumal.,1,23/03/2026,1
011978749257,8,Tentativa de golpe spam bloqueado,1,23/03/2026,2
06135339101,6,"Número sério Recebi 2 chamadas desse número. O que me preocupou de início é o nome que deram a chamada (não tenho contato desse hospital), que é Hospital Santa Helena, o que poderia ter me levado a atender. Onde moro, tem um hospital com esse mesmo nome, mas o DDD daqui é 62 (Goiânia-GO), o esse dessa chamada é 61 e o número é diferente. Então, alguém que sabe que sou de Goiânia, me liga com nome de hospital que tem aqui, sabe bem o que está fazendo. Não atendi em momento algum. Acredito que possa ser fraude e/ou golpe insinuando que um parente esteja internado ou algo similar.",1,23/03/2026,2
